{
  "contract_version": "2026-10-20",
  "command_id": "paper-command-demo",
  "attempt_id": "paper-attempt-demo",
  "intent_id": "paper-intent-demo",
  "parent_command_id": null,
  "environment": "PAPER",
  "venue_account_id": "paper-account-demo",
  "product": "SPOT",
  "instrument_uid": "paper-binance-spot-btcusdt",
  "operation": "SUBMIT",
  "logical_client_order_id": "paper-logical-order-demo",
  "venue_client_order_id": "paper-synthetic-order-000000000001",
  "venue_order_id": null,
  "target_order_id": null,
  "canonical_payload": {
    "side": "BUY",
    "order_type": "LIMIT",
    "quantity": "0.001",
    "price": "50000",
    "reduce_only": false,
    "full_position_exit": false,
    "position_side": "BOTH",
    "time_in_force": "GTC"
  },
  "payload_hash": "e9f6a97cf32fcecbe3d6448d23809162b3997d997f97e2916ae704c4f192aff6",
  "ownership_epoch": 1,
  "execution_epoch": 1,
  "policy_revision": 1,
  "state": "DURABLE_READY",
  "outcome_provenance": "NONE",
  "durable_record_ref": "paper-commit-demo",
  "created_at": "2026-10-20T06:39:02Z"
}
